[
  {
    "book_work_id": "book-work-BATCH-2026-002-001",
    "title": "Solving the Bottom Turtle",
    "subtitle": "A SPIFFE Way to Establish Trust in Your Infrastructure via Universal Identity",
    "alternate_titles": [
      "Solving the Bottom Turtle — a SPIFFE Way to Establish Trust in Your Infrastructure via Universal Identity"
    ],
    "authors": [
      "person-BATCH-2026-002-001",
      "person-BATCH-2026-002-002",
      "person-BATCH-2026-002-003",
      "person-BATCH-2026-002-004",
      "person-BATCH-2026-002-005",
      "person-BATCH-2026-002-006",
      "person-BATCH-2026-002-007",
      "person-BATCH-2026-002-008",
      "person-BATCH-2026-002-009",
      "person-BATCH-2026-002-010",
      "person-BATCH-2026-002-011",
      "person-BATCH-2026-002-012"
    ],
    "contributors": [],
    "original_language": "lang-en",
    "first_publication_date": "2020-11-17",
    "work_type": "collaborative_technical_book",
    "topics": [
      "governed-agent-identities",
      "identity-and-access-management"
    ],
    "central_subjects": [
      "SPIFFE and SPIRE",
      "workload identity",
      "universal service identity",
      "infrastructure trust"
    ],
    "inclusion_rationale": "Officially published, openly licensed treatment of workload identity and trust establishment that can inform—but must not be assumed identical to—AI-agent identity design.",
    "analysis_depth": "deeply_analyzed",
    "analysis_basis": "Complete first-edition PDF reviewed page by page from the official SPIFFE Project distribution",
    "central_thesis": "Modern distributed systems require automatically issued, short-lived workload identities rooted in attestation rather than network location or manually distributed secrets; SPIFFE defines the identity documents and SPIRE supplies the attestation and issuance machinery.",
    "principal_propositions": [
      "proposition-candidate-BATCH-2026-003-001",
      "proposition-candidate-BATCH-2026-003-002",
      "proposition-candidate-BATCH-2026-003-003",
      "proposition-candidate-BATCH-2026-003-004",
      "proposition-candidate-BATCH-2026-003-005",
      "proposition-candidate-BATCH-2026-003-006",
      "proposition-candidate-BATCH-2026-003-007",
      "proposition-candidate-BATCH-2026-003-008"
    ],
    "frameworks": [
      {
        "name": "Bottom-turtle trust bootstrap",
        "description": "Begin trust from locally verifiable platform evidence rather than a pre-positioned long-lived credential."
      },
      {
        "name": "Node and workload attestation",
        "description": "Separate validation of the hosting node from validation of the workload process before issuing an identity."
      },
      {
        "name": "Trust-domain architecture",
        "description": "Bound issuance authority, naming, federation, and compromise impact within explicit administrative domains."
      },
      {
        "name": "Staged adoption",
        "description": "Move from bridges and proxies toward native workload API integration while preserving rollback paths."
      }
    ],
    "evidence_base": "Technical architecture, threat-model reasoning, operational experience, historical examples, and five self-reported organizational case stories. It is a practitioner/project publication, not a controlled comparative study.",
    "executive_role_implications": {
      "CISO": "Own trust-domain policy, attestation assurance, authorization separation, compromise assumptions, and auditability.",
      "CIO": "Fund the identity control plane, migration sequencing, platform coverage, and operating model.",
      "CTO": "Set identity semantics, integration patterns, availability boundaries, and architectural constraints.",
      "General Counsel": "Review credential and access-log retention, privacy, evidence custody, and licensing obligations.",
      "CEO": "Align incentives and sponsorship for cross-functional migration rather than treating identity as a security-only project.",
      "Board Director": "Oversee concentration risk in identity infrastructure and the residual consequences of control-plane compromise."
    },
    "strongest_documented_arguments": [
      "Location-derived identity becomes brittle as workloads are scheduled dynamically across heterogeneous infrastructure.",
      "Short-lived credentials and automated attestation reduce dependence on manually distributed, long-lived bootstrap secrets.",
      "Authentication and authorization are distinct; a verified identity does not itself confer permission."
    ],
    "limitations": [
      "The case evidence is self-reported and does not isolate SPIFFE or SPIRE as the cause of the reported outcomes.",
      "The book is written by project participants and sometimes moves from design argument to ecosystem advocacy.",
      "Its workload identity model does not by itself encode an AI agent's sponsor, delegation chain, task purpose, model, session, or decision provenance.",
      "The 2020 edition predates later token formats, wider platform support, current AI-agent systems, and subsequent identity standards work."
    ],
    "counterpoints": [
      "NIST zero-trust guidance requires dynamic, per-request policy and contextual telemetry in addition to identity.",
      "NIST's 2026 software- and AI-agent concept work treats agent authority and authorization as distinct governance problems beyond workload authentication.",
      "A centralized signing service can become a high-impact target even when trust domains reduce blast radius."
    ],
    "later_author_interview_source_ids": [
      "later-author-source-BATCH-2026-003-001",
      "later-author-source-BATCH-2026-003-002",
      "later-author-source-BATCH-2026-003-003"
    ],
    "related_book_work_ids": [],
    "related_report_ids": [
      "counter-source-BATCH-2026-003-001",
      "counter-source-BATCH-2026-003-002",
      "counter-source-BATCH-2026-003-003"
    ],
    "changes_in_later_statements": [
      "Later SPIFFE specifications add WIT token SVIDs and refine federation and workload-endpoint behavior beyond the book's 2020 scope.",
      "Later author/project material documents serverless and Windows support, narrowing two deployment constraints visible in the first edition.",
      "Later adoption claims broaden the deployment evidence but remain ecosystem-reported rather than independent comparative evaluation."
    ],
    "edition_ids": [
      "book-edition-BATCH-2026-002-001"
    ],
    "related_source_ids": [
      "source-BATCH-2026-003-001"
    ],
    "related_statement_ids": [
      "statement-BATCH-2026-003-001",
      "statement-BATCH-2026-003-002",
      "statement-BATCH-2026-003-003",
      "statement-BATCH-2026-003-004",
      "statement-BATCH-2026-003-005",
      "statement-BATCH-2026-003-006",
      "statement-BATCH-2026-003-007",
      "statement-BATCH-2026-003-008",
      "statement-BATCH-2026-003-009",
      "statement-BATCH-2026-003-010",
      "statement-BATCH-2026-003-011",
      "statement-BATCH-2026-003-012",
      "statement-BATCH-2026-003-013",
      "statement-BATCH-2026-003-014",
      "statement-BATCH-2026-003-015",
      "statement-BATCH-2026-003-016",
      "statement-BATCH-2026-003-017",
      "statement-BATCH-2026-003-018"
    ],
    "related_proposition_ids": [
      "proposition-candidate-BATCH-2026-003-001",
      "proposition-candidate-BATCH-2026-003-002",
      "proposition-candidate-BATCH-2026-003-003",
      "proposition-candidate-BATCH-2026-003-004",
      "proposition-candidate-BATCH-2026-003-005",
      "proposition-candidate-BATCH-2026-003-006",
      "proposition-candidate-BATCH-2026-003-007",
      "proposition-candidate-BATCH-2026-003-008"
    ],
    "related_dossier_ids": [],
    "rights_notes": "Official PDF is licensed CC BY 4.0. This batch uses original paraphrases and no direct quotations; attribution and canonical link are retained.",
    "review_status": "deep_analysis_complete_machine_reviewed",
    "publication_status": "staging_only",
    "workflow_status": "propositions_mapped",
    "machine_review_status": "ready_for_human_review",
    "human_review_status": "pending",
    "reviewed_by": null,
    "reviewed_at": null,
    "provenance": [
      {
        "source_url": "https://spiffe.io/book/",
        "accessed_at": "2026-08-15",
        "retrieval_method": "Official publisher, project, or author-hosted bibliographic page inspected through public web access",
        "exact_locator": "Official work page and bibliographic metadata",
        "content_hash": null,
        "batch_id": "BATCH-2026-002",
        "prompt_id": "OEII-BOOK-METADATA",
        "prompt_version": "2.0",
        "notes": "Accepted discovery candidate candidate-BATCH-2026-001-095."
      },
      {
        "source_url": "https://spiffe.io/pdf/Solving-the-bottom-turtle-SPIFFE-SPIRE-Book.pdf",
        "accessed_at": "2026-08-15",
        "retrieval_method": "Complete exact edition retrieved from an official public source and reviewed in full",
        "exact_locator": "Complete 194-page PDF; printed and PDF page numbers align",
        "content_hash": "8353e3cf6fb8859ff34b0a43fe8146d7580dd32c9ace863c1a4758440f898fcb",
        "batch_id": "BATCH-2026-003",
        "prompt_id": "OEII-BOOK-DEEP-ANALYSIS",
        "prompt_version": "2.0",
        "notes": "Whole-edition analysis; no human approval granted"
      }
    ],
    "revision_history": [
      {
        "changed_at": "2026-08-15T00:00:00Z",
        "changed_by": "OEII analysis agent",
        "summary": "Advanced from catalogued metadata to complete-edition deep analysis.",
        "batch_id": "BATCH-2026-003"
      }
    ]
  },
  {
    "book_work_id": "book-work-BATCH-2026-002-005",
    "title": "Building Secure and Reliable Systems",
    "subtitle": "Best Practices for Designing, Implementing, and Maintaining Systems",
    "alternate_titles": [],
    "authors": [
      "person-BATCH-2026-002-019",
      "person-BATCH-2026-002-020",